{
  "schema_version": 1,
  "model": {
    "id": "loom-fixture/text",
    "name": "Weighted text fixture"
  },
  "programs": {
    "source": {
      "inputs": [
        {
          "path": "prepare.loom",
          "data": [
            "weights.loom"
          ]
        },
        "control.loom",
        "service.loom"
      ],
      "libraries": [
        "advance.loom"
      ],
      "config": {
        "fixture.bias_delta": 7
      }
    },
    "archive": {
      "inputs": [
        {
          "path": "service_module.loombc",
          "data": [
            "weights.loom"
          ]
        }
      ],
      "libraries": [
        "advance_module.loombc"
      ]
    },
    "mixed": {
      "inputs": [
        {
          "path": "prepare.loom",
          "data": [
            "weights.loom"
          ]
        },
        "service.loom",
        "control_module.loombc"
      ],
      "libraries": [
        "advance_module.loombc"
      ]
    }
  },
  "services": {
    "chat": {
      "kind": "text",
      "version": 1
    },
    "development": {
      "kind": "text"
    }
  },
  "variants": {
    "fixture": {
      "services": {
        "chat": {
          "programs": [
            "source",
            "archive",
            "mixed"
          ],
          "config": {
            "fixture.card": true,
            "fixture.bias_delta": 1
          },
          "parameters": {
            "model": {
              "files": [
                "metadata.safetensors",
                {
                  "path": "bias.data",
                  "format": "safetensors"
                }
              ]
            }
          },
          "tokenizers": {
            "text": "tokenizer.json"
          }
        },
        "development": {
          "programs": [
            "source",
            "archive",
            "mixed"
          ],
          "config": {
            "fixture.card": true,
            "fixture.bias_delta": 1
          },
          "parameters": {
            "model": {
              "files": [
                "metadata.safetensors",
                {
                  "path": "bias.data",
                  "format": "safetensors"
                }
              ]
            }
          },
          "tokenizers": {
            "text": "tokenizer.json"
          }
        }
      }
    }
  },
  "configurations": {
    "check": {
      "service": "chat",
      "variant": "fixture",
      "programs": "source",
      "execution": {
        "rows": 4,
        "context_capacity": 96,
        "pool_capacity": 256,
        "prefill_capacity": 32,
        "max_tokens": 16
      }
    }
  }
}
