{
  "$schema": "../../../../../py/loom/model/model-card.v1.schema.json",
  "schema_version": 1,
  "model": {
    "id": "loom-fixture/decision",
    "name": "Deterministic decision fixture"
  },
  "programs": {
    "fixture": {
      "inputs": [
        "prepare.loom",
        "control.loom",
        "service.loom"
      ],
      "libraries": [
        "config.loom",
        "decide.loom"
      ]
    }
  },
  "services": {
    "serve": {
      "kind": "decision",
      "version": 1
    }
  },
  "variants": {
    "fixture": {
      "services": {
        "serve": {
          "programs": [
            "fixture"
          ]
        }
      }
    }
  },
  "configurations": {
    "check": {
      "service": "serve",
      "variant": "fixture",
      "programs": "fixture",
      "execution": {
        "pending_requests": 4,
        "options": {
          "batch_units": 64
        }
      }
    }
  }
}
